{
  "status": "passed",
  "event": "mailboxExists",
  "details": "The mailbox exists.",
  "email": "john.doe@gmial.com",
  "emailSuggested": "john.doe@gmail.com",
  "mailbox": "john.doe",
  "domain": "gmial.com",
  "mxIp": "142.250.190.27",
  "mxLocation": "US",
  "possibleSpamtrap": false,
  "isComplainer": false,
  "isDisposable": false,
  "isFreeService": true,
  "isOffensive": false,
  "isRoleAccount": false,
  "isGibberish": false,
  "remaining": "9939",
  "execution": 0.395
}
